[
  {
    "capture_id": "do009-capture",
    "channel": 0,
    "duration_ns": 250000000,
    "estimated_start_tick": 0,
    "midi_note": 60,
    "note_off_event_id": "raw-0-off",
    "note_off_time_ns": 250000000,
    "note_on_event_id": "raw-0-on",
    "note_on_time_ns": 0,
    "observed_event_id": "observed-0",
    "practice_onset_seconds": 0.0,
    "repetition_index": 0,
    "schema_version": "1.0.0",
    "source_device": "deterministic-fake",
    "source_string": null,
    "status": "complete",
    "velocity": 90
  },
  {
    "capture_id": "do009-capture",
    "channel": 0,
    "duration_ns": 250000000,
    "estimated_start_tick": 480,
    "midi_note": 63,
    "note_off_event_id": "raw-1-off",
    "note_off_time_ns": 750000000,
    "note_on_event_id": "raw-1-on",
    "note_on_time_ns": 500000000,
    "observed_event_id": "observed-1",
    "practice_onset_seconds": 0.5,
    "repetition_index": 0,
    "schema_version": "1.0.0",
    "source_device": "deterministic-fake",
    "source_string": null,
    "status": "complete",
    "velocity": 90
  },
  {
    "capture_id": "do009-capture",
    "channel": 0,
    "duration_ns": 250000000,
    "estimated_start_tick": 960,
    "midi_note": 67,
    "note_off_event_id": "raw-2-off",
    "note_off_time_ns": 1250000000,
    "note_on_event_id": "raw-2-on",
    "note_on_time_ns": 1000000000,
    "observed_event_id": "observed-2",
    "practice_onset_seconds": 1.0,
    "repetition_index": 0,
    "schema_version": "1.0.0",
    "source_device": "deterministic-fake",
    "source_string": null,
    "status": "complete",
    "velocity": 90
  }
]
